QueryDate,URL,MobileURL,Date,Title
2021-10-28,https://www.prnewswire.com/news-releases/social-robots-market-size-to-grow-by-usd-1-10-bn-from-2020-to-2025--technological-advances-in-social-robots-to-boost-market-growth--17-000-technavio-research-reports-301408889.html,,2021-10-28 01:15:00,Social Robots Market Size to Grow by USD 1 . 10 bn from 2020 to 2025 | Technological Advances in Social Robots to Boost Market Growth
2021-10-29,https://www.idahostatejournal.com/news/national/the-linux-foundation-announces-conference-schedule-for-open-source-summit-japan-automotive-linux-summit-2021/article_3973ee7e-682f-5d2f-83d5-b8ab269e321c.html,,2021-10-29 00:00:00,The Linux Foundation Announces Conference Schedule for Open Source Summit Japan + Automotive Linux Summit 2021
2021-11-01,https://en.acnnewswire.com/press-release/english/70614/hitachi-participates-in-cop26-as-a-principal-partner,,2021-11-01 03:00:00,
2021-11-02,http://kyn24.com/2021/11/02/elevator-and-escalator-market-to-witness-robust-expansion-throughout-the-forecast-period-2021-2030/,http://kyn24.com/2021/11/02/elevator-and-escalator-market-to-witness-robust-expansion-throughout-the-forecast-period-2021-2030/amp/,2021-11-02 04:15:00,Elevator and Escalator Market to Witness Robust Expansion Throughout the Forecast Period 2021 - 2030 – Kentucky Journal 24
2021-11-03,https://brazilbusiness.einnews.com/pr_news/555315067/steel-long-products-market-to-reach-844-13-bn-by-2027-growth-opportunities-with-nippon-jsw-jfe-hyundai,https://brazilbusiness.einnews.com/amp/pr_news/555315067/steel-long-products-market-to-reach-844-13-bn-by-2027-growth-opportunities-with-nippon-jsw-jfe-hyundai,2021-11-03 03:00:00,"Steel Long Products Market to Reach $844 . 13 BN By 2027 Growth Opportunities with Nippon , JSW , JFE , Hyundai"
2021-11-04,https://en.acnnewswire.com/press-release/english/70705/ferrovienord-and-hitachi-rail-sign-contract-for-50-high-capacity-trains,,2021-11-04 01:45:00,
2021-11-05,https://www.finanznachrichten.de/nachrichten-2021-11/54404253-hitachi-rail-to-receive-100-renewable-electricity-from-scottishpower-011.htm,,2021-11-05 06:15:00,Hitachi Rail to Receive 100 % Renewable Electricity from ScottishPower
2021-11-08,"https://en.acnnewswire.com/press-release/english/70784/hitachi,-ltd.-and-cbs-corporate-business-solutions-support-fast-and-efficient-transition-of-japanese-companies-to-sap-s/4hana",,2021-11-08 05:45:00,
2021-11-09,https://menafn.com/1103125187/Air-Circuit-Breakers-Market-to-Eyewitness-Potential-Growth-till-2031-insightSLICE&source=29,,2021-11-09 01:00:00,Air Circuit Breakers Market to Eyewitness Potential Growth t ... 
2021-11-10,https://www.prnewswire.com:443/news-releases/usd-7-70-billion-growth-in-light-projector-market--aaxa-technologies-inc-acer-inc-and-benq-corp-emerge-as-dominant-players--technavio-301418800.html,,2021-11-10 03:45:00,"USD 7 . 70 billion growth in Light Projector Market | AAXA Technologies Inc ., Acer Inc ., and BenQ Corp . emerge as dominant players"
2021-11-11,http://www.comunicati.net/comunicati/arte/musica/lirica/739859.html,,2021-11-11 08:30:00,CMOS Image Sensors Market to Flourish with an Impressive CAGR during 2026
2021-11-12,http://www.comunicati.net/comunicati/arte/musica/new_age/740134.html,,2021-11-12 02:45:00,Electronics Retailing Market Size – Strategic Assessment and Forecast Till 2028
2021-11-15,https://www.globenewswire.com/news-release/2021/11/15/2333856/0/en/Electric-Powertrain-Market-Research-Report-by-Vehicle-Type-by-HEV-PHEV-Powertrain-Component-by-48v-MHEV-Powertrain-Component-by-BEV-Powertrain-Component-by-Powertrain-Type-by-Regio.html,,2021-11-15 09:15:00,"Electric Powertrain Market Research Report by Vehicle Type , "
2021-11-16,https://www.prnewswire.com:443/news-releases/usd-89-5-bn-growth-in-household-appliance-market-ab-electrolux-haier-smart-home-co-ltd-and-hitachi-ltd-emerge-as-dominant-players--technavio-301423102.html,,2021-11-16 04:00:00,"USD 89 . 5 Bn growth in Household Appliance Market , AB Electrolux , Haier Smart Home Co . Ltd ., and Hitachi Ltd . emerge as dominant players"
2021-11-17,https://www.finanznachrichten.de/nachrichten-2021-11/54510661-hitachi-energy-launches-identiq-digital-twin-for-sustainable-flexible-and-secure-power-grids-011.htm,,2021-11-17 02:15:00,"Hitachi Energy Launches IdentiQ Digital Twin for Sustainable , Flexible and Secure Power Grids"
2021-11-18,https://www.prnewswire.com:443/news-releases/usd-1-64-bn-growth-in-content-intelligence-market-from-2020-to-2025-increasing-demand-for-customer-acquisition-to-boost-market--17000-technavio-reports-301425745.html,,2021-11-18 00:45:00,USD 1 . 64 bn growth in Content Intelligence Market from 2020 to 2025 |Increasing Demand for Customer Acquisition to Boost Market
2021-11-19,https://it-online.co.za/2021/11/19/nu-bolsters-networking-and-storage-division/,,2021-11-19 10:45:00,NU bolsters networking and storage division
2021-11-22,http://itbusinessnet.com/2021/11/hitachi-selected-by-the-university-of-tsukuba-for-its-second-proton-therapy-system-as-a-pfi-project/,http://itbusinessnet.com/2021/11/hitachi-selected-by-the-university-of-tsukuba-for-its-second-proton-therapy-system-as-a-pfi-project/amp/,2021-11-22 06:45:00,Hitachi Selected by the University of Tsukuba for its Second Proton Therapy System as a PFI Project
2021-11-23,http://www.publicnow.com/view/F02A3DCBD013A41713F1C35A935D2D437DDB41DC,,2021-11-23 00:30:00,Hitachi Electronic Devices ( USA ) Inc . ( via Public ) / Hitachi Selected by the University of Tsukuba for its Second Proton Therapy System as a PFI Project
2021-11-24,https://foreignaffairs.co.nz/2021/11/24/mil-osi-asia-pac-prime-minister-meets-with-representatives-of-japanese-firms-universities/,,2021-11-24 12:15:00,"MIL - OSI Asia - Pac : Prime Minister meets with representatives of Japanese firms , universities"
2021-11-25,https://www.prnewswire.com:443/news-releases/automotive-ignition-coil-market-to-exceed-us-2-6-bn-as-demand-increases-within-passenger-cars-at-4-8-cagr-fmi-301431752.html,,2021-11-25 03:00:00,Automotive Ignition Coil Market to Exceed US$ 2 . 6 Bn as Demand Increases Within Passenger Cars at 4 . 8 % CAGR : FMI
2021-11-26,https://www.globenewswire.com/news-release/2021/11/26/2341293/0/en/HVAC-Equipment-Market-Size-to-Hit-US-206-89-Billion-by-2030.html,,2021-11-26 00:30:00,HVAC Equipment Market Size to Hit US$ 206 . 89 Billion by
2021-11-29,http://kyn24.com/2021/11/29/x-ray-system-market-to-witness-robust-expansion-throughout-the-forecast-2021-2031/,http://kyn24.com/2021/11/29/x-ray-system-market-to-witness-robust-expansion-throughout-the-forecast-2021-2031/amp/,2021-11-29 06:30:00,X - ray System Market to Witness Robust Expansion throughout the Forecast 2021 - 2031 – Kentucky Journal 24
2021-11-30,https://www.easternherald.com/2021/11/30/hitachi-solutions-named-as-a-leader-in-the-2021-idc-marketscape-asia-pacific-microsoft-dynamics-365-implementation-services/,https://www.easternherald.com/2021/11/30/hitachi-solutions-named-as-a-leader-in-the-2021-idc-marketscape-asia-pacific-microsoft-dynamics-365-implementation-services/?amp=1,2021-11-30 04:15:00,Hitachi Solutions Named as a Leader in the 2021 IDC MarketScape : Asia / Pacific Microsoft Dynamics 365 Implementation Services
2021-12-01,https://www.briefingwire.com/pr/radiography-test-equipment-market-forecast-2021-2026,,2021-12-01 08:00:00,Radiography Test Equipment Market - Forecast 2021
2021-12-02,https://www.marketwatch.com/story/asian-tech-companies-climate-goals-fall-short-in-new-greenpeace-report-271638418343,https://www.marketwatch.com/amp/story/asian-tech-companies-climate-goals-fall-short-in-new-greenpeace-report-271638418343,2021-12-02 04:30:00,Asian Tech Companie Climate Goals Fall Short in New Greenpeace Report
2021-12-03,http://www.comunicati.net/comunicati/arte/musica/jazz/744880.html,,2021-12-03 02:45:00,"SCADA Market Report , History and Forecast 2021 - 2028 , Breakdown Data by Manufacturers , Key"
2021-12-06,https://menafn.com/1103309674/Failure-Analysis-Market-Report-2021-26-Industry-Size-Share-Growth-Opportunity-and-Forecast&source=24,,2021-12-06 06:30:00,"Failure Analysis Market Report 2021 - 26 : Industry Size , Share ... "
2021-12-07,https://www.sandiegosun.com/news/271882447/elevator-modernization-market-may-see-big-move--kohler-elevator-thyssenkrupp-hitachi,,2021-12-07 00:30:00,"Elevator Modernization Market May See Big Move | Kohler Elevator , ThyssenKrupp , Hitachi"
2021-12-08,https://www.finanznachrichten.de/nachrichten-2021-12/54692240-hitachi-achieves-cdp-s-highest-score-of-grade-a-in-climate-change-and-water-security-011.htm,,2021-12-08 03:45:00,Hitachi Achieves CDP Highest Score of Grade A in Climate Change and Water Security
2021-12-09,https://www.prnewswire.com:443/news-releases/44-growth-to-originate-from-apac-for-hydrogen-compressor-market-growth-trends-covid-19-impact-and-forecasts-2021---2025--technavio-301440873.html,,2021-12-09 08:00:00,"44 % Growth to Originate from APAC for Hydrogen Compressor Market : Growth , Trends , COVID - 19 Impact , and Forecasts ( 2021 - 2025 ) "
2021-12-10,https://www.japantimes.co.jp/news/2021/12/10/business/corporate-business/hitachi-shinkansen-uk/,,2021-12-10 03:45:00,Hitachi and Alstom win ¥300 billion train deal for U . K . HS2 route
2021-12-13,https://brazilbusiness.einnews.com/pr_news/558246427/white-goods-market-industry-analysis-opportunities-datam-intelligence,https://brazilbusiness.einnews.com/amp/pr_news/558246427/white-goods-market-industry-analysis-opportunities-datam-intelligence,2021-12-13 07:00:00,White Goods Market : Industry Analysis & Opportunities - DataM Intelligence
2021-12-14,https://en.acnnewswire.com/press-release/english/71847/hitachi-high-tech-develops-the-electron-beam-area-inspection-system-gs1000-to-meet-increased-demand-for-inspection-and-massive-metrology-in-euv-applic,,2021-12-14 06:15:00,
2021-12-15,https://www.prnewswire.com/news-releases/electric-vehicle-motor-to-record-15-98-of-y-o-y-growth-rate-in-2021--continental-ag---one-of-the-leading-companies-launched-a-new-loader-tire-namely-the-compactmaster-em-in-october-2021--technavio-301443433.html,,2021-12-15 02:30:00,"Electric Vehicle Motor to Record 15 . 98 % of Y - O - Y Growth Rate in 2021 | Continental AG - One of the Leading Companies launched a new loader tire , namely the CompactMaster EM in October 2021"
2021-12-16,https://menafn.com/1103375147/Sputter-Targets-Market-Size-Demand-Growth-Analysis-Trends-Share-Revenue-Industry-Forecast-2028&source=24,,2021-12-16 08:15:00,"Sputter Targets Market Size , Demand , Growth Analysis , Trends ... "
2021-12-17,https://menafn.com/1103383537/Soft-Magnet-Powder-Market-Emerging-Trends-and-Global-Demand-SG-Technologies-Ltd-Vacuumschmelze-GmbH-Co-Ltd&source=29,,2021-12-17 04:00:00,Soft Magnet Powder Market Emerging Trends and Global Demand| ... 
2021-12-20,https://menafn.com/1103402464/Global-Electric-Motor-Market-Report-2021-2030-Development-of-High-Power-to-Weight-Ratio-Electric-Motors-Gaining-Momentum,,2021-12-20 12:15:00,Global Electric Motor Market Report 2021 - 2030 : Development o ... 
2021-12-21,https://www.globenewswire.com/news-release/2021/12/21/2355754/0/en/Image-Recognition-Market-to-Hit-86-32-Billion-by-2027-Rapid-Advancements-in-Face-Detection-Technologies-to-Drive-Market-Growth-Fortune-Business-Insights.html,,2021-12-21 08:00:00,Image Recognition Market to Hit $86 . 32 Billion by 2027 ; 
2021-12-22,https://www.prnewswire.com:443/news-releases/business-intelligence-bi-and-analytics-platforms-market-size-to-grow-by-usd-21-72-billion--market-research-insights-highlight-rising-need-to-improve-business-efficiency-as-key-driver--technavio-301449217.html,,2021-12-22 04:30:00,Business Intelligence ( BI ) and Analytics Platforms Market Size to grow by USD 21 . 72 billion | Market Research Insights Highlight Rising need to Improve Business Efficiency as Key Driver
2021-12-23,https://english.kyodonews.net/news/2021/12/455af03b87a0-update1-hitachi-unit-admits-to-cheating-in-brake-suspension-inspections.html,,2021-12-23 01:00:00,"Hitachi unit admits to cheating in brake , suspension inspections"
2021-12-24,https://www.galvnews.com/news_ap/business/article_1effe23c-d9b8-500c-aa46-14fc95eca4e5.html,,2021-12-24 00:45:00,"Global Light Projector Market to 2025 - Featuring Acer , Canon and Hitachi Among Others - ResearchAndMarkets . com"
2021-12-27,https://www.globenewswire.com/news-release/2021/12/27/2358055/0/en/Global-Magnetic-Materials-Market-to-Reach-162-6-Billion-by-2027.html,,2021-12-27 19:30:00,Global Magnetic Materials Market to Reach $162 . 6 Billion
2021-12-28,https://www.globenewswire.com/news-release/2021/12/28/2358461/0/en/Global-Machine-Automation-Controllers-Market-to-Reach-45-1-Billion-by-2027.html,,2021-12-28 14:15:00,Global Machine Automation Controllers Market to Reach $45 . 1
2021-12-29,http://www.comunicati.net/comunicati/aziende/tecnologia/750279.html,,2021-12-29 11:00:00,Battery Market Outlook 2021 | Industry Insights & Opportunity Evaluation Till 2027
2021-12-30,https://www.bignewsnetwork.com/news/272061094/global-hybrid-train-market-2021-developing-technologies-and-forecast-by-2028-alstom-bombardier-inc-crrc-kawasaki-siemens,,2021-12-30 08:45:00,"Global Hybrid Train Market 2021 Developing Technologies and Forecast by 2028 Alstom , Bombardier Inc ., CRRC , Kawasaki , Siemens"
2021-12-31,https://menafn.com/1103468074/Fixed-Mobile-C-arms-Market-To-Reach-USD-29898-Million-By-2028-Reports-And-Data&source=139,,2021-12-31 09:00:00,"Fixed & Mobile C - arms Market To Reach USD 2 , 989 . 8 Million By ... "
2022-01-03,https://menafn.com/1103478426/VVT-and-Start-Stop-System-Market-to-Garner-Business-Worth-520647-million-at-92-CAGR-by-2025&source=24,,2022-01-03 09:15:00,VVT and Start - Stop System Market to Garner Business Worth $5 ... 
2022-01-04,https://www.texasguardian.com/news/272094255/lithium-ion-energy-accumulator-market-emerging-trends-and-global-demand--asahi-kasei-panasonic-samsung-toshiba,,2022-01-04 00:15:00,"Lithium Ion Energy Accumulator Market Emerging Trends and Global Demand | Asahi Kasei , Panasonic , Samsung , Toshiba"
2022-01-05,https://www.prnewswire.com/news-releases/31-of-growth-to-originate-from-north-america-for-passenger-information-system-market-by-mode-of-transportation-railways-roadways-and-air-and-waterways-and-region---global-forecast-to-2025-301451948.html,,2022-01-05 05:00:00,"31 % of Growth to Originate from North America for Passenger Information System Market : By Mode of Transportation ( railways , roadways , and air and waterways ) and Region"
2022-01-06,https://www.prnewswire.com:443/news-releases/38-of-growth-to-originate-from-north-america-for-power-tool-batteries-market-evolving-opportunities-with-battery-xpress-byd-co-ltd--e-one-moli-energy-corp--17000-technavio-reports-301453627.html,,2022-01-06 00:30:00,"38 % of Growth to Originate from North America for Power Tool Batteries Market |Evolving Opportunities with Battery Xpress , BYD Co . Ltd . & E One Moli Energy Corp . "
2022-01-07,https://www.pharmiweb.com/press-release/2022-01-06/image-guided-radiotherapy-market-in-depth-analysis-by-statistics-outlook-2031-factmr,,2022-01-07 01:00:00,Image Guided Radiotherapy Market In - depth Analysis by Statistics & Outlook 2031 | Fact . MR
2022-01-10,https://www.taiwannews.com.tw/en/news/4403809,,2022-01-10 04:45:00,"Interactive Whiteboards Market - With the Best Scope , Trends , Benefits , Opportunities to 2031 | Taiwan News"
2022-01-11,https://energy.einnews.com/pr_news/560319523/air-compressor-market-to-reach-usd-22-27-billion-by-2028-sullair-includes-novel-product-in-portfolio-to-broaden-business-value-fortune-business,,2022-01-11 07:45:00,Air Compressor Market to Reach USD 22 . 27 Billion by 2028 ; Sullair Includes Novel Product in Portfolio to Broaden Business Value : Fortune Business Insights™
2022-01-12,https://www.briefingwire.com/pr/argentina-automotive-electric-actuators-market-forecast-2021-2026,,2022-01-12 06:45:00,Argentina Automotive Electric Actuators Market - Forecast 2021
2022-01-13,https://www.msn.com/en-gb/money/technology/hitachi-to-sell-about-half-of-its-stake-in-construction-unit-nhk/ar-AASJ400,,2022-01-13 06:45:00,Hitachi to sell about half of its stake in construction unit
2022-01-14,https://www.bnnbloomberg.ca/hitachi-to-sell-half-its-machinery-unit-stake-for-1-6-billion-1.1707492,https://www.bnnbloomberg.ca/hitachi-to-sell-half-its-machinery-unit-stake-for-1-6-billion-1.1707492.amp.html,2022-01-14 08:30:00,Hitachi to Sell Half Its Machinery Unit Stake for $1 . 6 Billion
2022-01-17,https://www.asahi.com/ajw/articles/14516632,,2022-01-17 01:30:00,"Japan chalks up a record number of M & A deals in 2021 | The Asahi Shimbun : Breaking News , Japan News and Analysis"
2022-01-18,https://www.bloombergquint.com/business/shakeup-at-showa-denko-bets-on-chipmakers-next-design-challenge,/amp/business/shakeup-at-showa-denko-bets-on-chipmakers-next-design-challenge,2022-01-18 01:45:00,Shakeup at Showa Denko Bets on Chipmaker Next Design Challenge
2022-01-19,https://www.texasguardian.com/news/272201703/construction-equipment-market-size-is-expected-to-reach-261047-million-in-2027,,2022-01-19 00:15:00,"Construction Equipment Market size is expected to reach $261 , 047 million in 2027"
2022-01-20,https://www.equipmentworld.com/equipment/article/15287282/hitachi-ltd-to-sell-stake-in-hitachi-construction-machinery,,2022-01-20 00:00:00,Hitachi Ltd . to sell stake in Hitachi Construction Machinery
2022-01-21,https://www.prnewswire.co.uk/news-releases/battery-power-tools-market-to-reach-41-1-bn-globally-by-2030-at-6-9-cagr-allied-market-research-830651300.html,,2022-01-21 01:00:00,"Battery Power Tools Market to Reach $41 . 1 Bn , Globally , by 2030 at 6 . 9 % CAGR : Allied Market Research"
2022-01-24,https://www.digitaljournal.com/pr/smart-manufacturing-platform-market-to-witness-impressive-growth-by-2026-sap-ibm-ptc,,2022-01-24 10:15:00,"Smart Manufacturing Platform Market to Witness Impressive Growth by 2026 | SAP , IBM , PTC"
2022-01-25,https://www.prnewswire.com:443/news-releases/coding-and-marking-equipment-market-to-record-3-82-y-o-y-growth-rate-in-2021-increasing-need-for-product-traceability-to-boost-market-17000-technavio-reports-301465937.html,,2022-01-25 01:30:00,Coding and Marking Equipment Market to Record 3 . 82 % Y - O - Y Growth Rate in 2021| Increasing need for Product Traceability to Boost Market
2022-01-26,https://www.bignewsnetwork.com/news/272231467/solid-state-drives-ssd-market-2022-industry-key-players-share-trend-segmentation-and-forecast-to-2028,,2022-01-26 00:15:00,"Solid State Drives ( SSD ) Market 2022 Industry Key Players , Share , Trend , Segmentation and Forecast to 2028"
2022-01-27,https://www.finanznachrichten.de/nachrichten-2022-01/55081596-hitachi-energy-ltd-hitachi-energy-achieves-100-fossil-free-electricity-in-own-operations-399.htm,,2022-01-27 08:45:00,Hitachi Energy Ltd .: Hitachi Energy achieves 100 % fossil free electricity in own operations
2022-01-28,https://www.finanznachrichten.de/nachrichten-2022-01/55092352-hitachi-energy-achieves-100-fossil-free-electricity-in-own-operations-011.htm,,2022-01-28 03:30:00,Hitachi Energy Achieves 100 % Fossil - free Electricity in Own Operations
2022-01-31,https://www.prnewswire.co.uk/news-releases/hydrogen-compressor-market-to-reach-2-66-bn-globally-by-2030-at-4-0-cagr-allied-market-research-844628880.html,,2022-01-31 13:30:00,"Hydrogen Compressor Market to Reach $2 . 66 Bn , Globally , by 2030 at 4 . 0 % CAGR : Allied Market Research"
2022-02-01,https://menafn.com/1103622759/Automotive-Parts-Aftermarket-Revenue-to-Rise-Substantially-Owing-to-Increasing-End-use-Adoption&source=24,,2022-02-01 09:00:00,Automotive Parts Aftermarket Revenue to Rise Substantially O ... 
2022-02-02,https://en.acnnewswire.com/press-release/english/72818/shonan-kamakura-advanced-medical-center-begins-treatment-with-hitachi,,2022-02-02 05:00:00,
2022-02-03,http://www.blackseagrain.net/2022/02/02/elevator-safety-system-market-insights-on-future-growth-prospects-and-industry-trends-analyzed-till-2027/,,2022-02-03 00:00:00,Elevator Safety System Market Insights On Future Growth Prospects And Industry Trends Analyzed Till 2027
2022-02-04,https://www.sandiegosun.com/news/272264641/data-center-cooling-market-2022-explore-top-factors-that-will-boost-the-global-market-by-2027,,2022-02-04 00:00:00,Data Center Cooling Market 2022 : Explore Top Factors that Will Boost the Global Market by 2027
2022-02-07,https://economictimes.indiatimes.com/news/international/business/where-is-china-investing-communist-leaders-are-becoming-venture-capitalists/articleshow/89396597.cms,https://m.economictimes.com/news/international/business/where-is-china-investing-communist-leaders-are-becoming-venture-capitalists/amp_articleshow/89396597.cms,2022-02-07 05:45:00,Where is China investing ? Communist leaders are becoming venture capitalists
2022-02-08,https://www.globalbankingandfinance.com/dc-switchgear-market-to-reach-a-valuation-of-us-15-billion-by-2026-comprehensive-research-report-by-fmi/,https://www.globalbankingandfinance.com/dc-switchgear-market-to-reach-a-valuation-of-us-15-billion-by-2026-comprehensive-research-report-by-fmi/amp/,2022-02-08 05:00:00,DC Switchgear Market to reach a valuation of US$ 15 Billion by 2026 - Comprehensive Research Report by FMI
2022-02-09,https://www.investing.com/news/economy/chinas-zerocovid-curbs-may-hurt-global-growth-says-boj-policymaker-2759935,https://m.investing.com/news/economy/chinas-zerocovid-curbs-may-hurt-global-growth-says-boj-policymaker-2759935?ampMode=1,2022-02-09 02:45:00,"China  zero - COVID  curbs may hurt global growth , says BOJ policymaker By Reuters"
2022-02-10,https://www.sandiegosun.com/news/272282824/increasing-chronic-disease-and-awareness-related-to-it-will-augment-the-global-diagnostic-imaging-services-market-at-a-cagr-of-60-in-the-forecast-period-of-2021-2026,,2022-02-10 02:15:00,Increasing Chronic Disease And Awareness Related To It Will Augment The Global Diagnostic Imaging Services Market At A CAGR Of 6 . 0 % In The Forecast Period Of 2021 - 2026
2022-02-11,https://finance.yahoo.com/news/global-mri-systems-market-report-094300975.html,https://finance.yahoo.com/amphtml/news/global-mri-systems-market-report-094300975.html,2022-02-11 10:15:00,"Global MRI Systems Market Report 2021 : Market was Valued at $7 . 13 Billion in 2020 - Forecast to 2026 by Architecture ( Closed , Open ), Field Strength ( <1 . 5T , 1 . 5T"
2022-02-14,https://www.prnewswire.com/news-releases/united-states-consumer-electronics-and-appliances-market-report-2022-focus-on-the-10-leading-states---california-texas-florida-new-york-pennsylvania-illinois-ohio-georgia-north-carolina-michigan-301480582.html,,2022-02-14 00:45:00,"United States Consumer Electronics and Appliances Market Report 2022 : Focus on the 10 Leading States - California , Texas , Florida , New York , Pennsylvania , Illinois , Ohio , Georgia , North Carolina , Michigan"
2022-02-15,https://www.texasguardian.com/news/272298002/vvt-and-start-stop-system-market-2022-product-development-strategies-by-prominent-players-continental-ag-mitsubishi-electric-corp-robert-bosch-gmbh-delphi-automotive-plc-denso-corp,,2022-02-15 01:15:00,"VVT and Start - Stop System Market 2022 Product Development Strategies by Prominent Players : Continental AG , Mitsubishi Electric Corp , Robert Bosch Gmbh , Delphi Automotive PLC , Denso Corp"
2022-02-16,https://www.finanznachrichten.de/nachrichten-2022-02/55255058-hitachi-energy-ltd-hitachi-energy-brings-5g-connectivity-to-mission-critical-industrial-and-utility-operations-399.htm,,2022-02-16 08:45:00,Hitachi Energy Ltd .: Hitachi Energy brings 5G connectivity to mission - critical industrial and utility operations
2022-02-17,https://www.finanznachrichten.de/nachrichten-2022-02/55265124-hitachi-energy-brings-5g-connectivity-to-mission-critical-industrial-and-utility-operations-011.htm,,2022-02-17 01:30:00,Hitachi Energy Brings 5G Connectivity to Mission - critical Industrial and Utility Operations
2022-02-18,https://www.bnnbloomberg.ca/biggest-air-conditioner-maker-readies-billions-to-expand-in-warmer-world-1.1725272,https://www.bnnbloomberg.ca/biggest-air-conditioner-maker-readies-billions-to-expand-in-warmer-world-1.1725272.amp.html,2022-02-18 02:30:00,Biggest Air - Conditioner Maker Readies Billions to Expand in Warmer World
2022-02-21,https://www.prnewswire.com:443/news-releases/india-coding-and-marking-systems-market-revenue-to-surpass-127-6-million-by-2030--says-ps-intelligence-301486278.html,,2022-02-21 07:15:00,"India Coding and Marking Systems Market Revenue to Surpass $127 . 6 Million by 2030 , says P & S Intelligence"
2022-02-22,https://www.finanznachrichten.de/nachrichten-2022-02/55300319-hitachi-solutions-wins-microsoft-malaysia-business-applications-partner-of-the-year-2021-award-008.htm,,2022-02-22 03:15:00,Hitachi Solutions Wins Microsoft Malaysia Business Applications Partner of the Year 2021 Award
2022-02-23,https://www.digitaljournal.com/pr/elevators-and-escalators-market-revenue-opportunity-forecast-2022-2030,,2022-02-23 08:30:00,"Elevators and Escalators Market Revenue , Opportunity , Forecast 2022 – 2030"
2022-02-24,https://www.newyorktelegraph.com/news/272329510/sap-digital-services-ecosystem-market-is-set-to-fly-high-in-years-to-come--dxc-technology-capgemini-ibm,,2022-02-24 01:00:00,"SAP Digital Services Ecosystem Market is Set To Fly High in Years to Come | DXC Technology , Capgemini , IBM"
2022-02-25,https://menafn.com/1103761120/Production-Monitoring-Market-Outlook-2026-Insights-Future-Trends-and-Forecasts&source=24,,2022-02-25 06:30:00,"Production Monitoring Market Outlook 2026 - Insights , Future ... "
2022-02-28,https://apnews.com/press-release/pr-newswire/business-africa-philanthropy-united-nations-32c809c68d95a7744434a026e8e1196b,,2022-02-28 00:45:00,Global Energy Alliance for People and Planet announces Simon Harford as CEO and Ravi Venkatesan as Board Chair
