QueryDate,URL,MobileURL,Date,Title
2023-06-23,http://www.itnewsonline.com/PRNewswire/Power-transformers-market-size-to-grow-by-USD-11575.07-million-from-2022-to-2027-Driven-by-modernization-of-existing-transformers---Technavio/928575,,2023-06-23 00:30:00,"Power transformers market size to grow by USD 11 , 575 . 07 million from 2022 to 2027 ; Driven by modernization of existing transformers"
2023-06-26,https://www.prnewswire.com/news-releases/air-conditioning-market-size-is-to-grow-by-usd-19-65-billion-from-2022-to-2027--the-increasing-demand-for-inverter-air-conditioners-drives-the-market---technavio-301860942.html,,2023-06-26 06:45:00,"Air Conditioning Market size is to grow by USD 19 . 65 billion from 2022 to 2027 , The increasing demand for inverter air conditioners drives the market"
2023-06-27,https://www.tmcnet.com/usubmit/2023/06/27/9839264.htm,,2023-06-27 08:30:00,Fibre Optic Cables Market Expanding at 13 . 50 % CAGR : Exclusive Report by Delvens
2023-06-28,https://www.globenewswire.com/news-release/2023/06/28/2696291/0/en/Global-On-demand-PET-Scanners-Market-Size-3-595-7-Mn-Feasibility-Study-Growth-Rate-at-5-9-From-2023-to-2032-Market-us.html,,2023-06-28 13:30:00,"Global On - demand PET Scanners Market Size ( $ 3 , 595 . 7 Mn ) "
2023-06-29,https://www.benzinga.com/pressreleases/23/06/g33054413/railway-wiring-harness-market-worth-1-9-billion-by-2026-exclusive-report-by-marketsandmarkets,https://www.benzinga.com/amp/content/33054413,2023-06-29 10:00:00,Railway Wiring Harness Market worth $1 . 9 billion by 2026 – Exclusive Report by MarketsandMarkets™
2023-06-30,https://www.prnewswire.com/news-releases/lithium-ion-battery-market-size-to-grow-by-usd-198-26-billion-from-2022-to-2027augmented-demand-from-consumer-electronics-to-boost-the-market-growth--technavio-301867162.html,,2023-06-30 11:30:00,Lithium - ion Battery Market size to grow by USD 198 . 26 billion from 2022 to 2027|Augmented demand from consumer electronics to boost the market growth - Technavio
2023-07-03,https://www.globenewswire.com/news-release/2023/07/03/2698259/0/en/Microgrid-Control-System-Market-to-Worth-USD-7-5-Billion-by-2030-Skyquest-Technology.html,,2023-07-03 05:00:00,Microgrid Control System Market to Worth USD 7 . 5 Billion by
2023-07-04,https://www.prnewswire.com/news-releases/global-water-recycle-and-reuse-market-is-expected-to-grow-at-a-cagr-of-10-8-during-2023-2028--301869121.html,,2023-07-04 01:45:00,Global Water Recycle and Reuse Market is Expected to Grow at a CAGR of 10 . 8 % During 2023 - 2028
2023-07-05,https://www.prnewswire.com/news-releases/data-center-ups-market-size-to-grow-by-usd-4-991-08-million-from-2022-to-2027increasing-adoption-of-modular-ups-systems-is-one-of-the-key-drivers---technavio-301869285.html,,2023-07-05 03:30:00,"Data Center UPS Market size to grow by USD 4 , 991 . 08 million from 2022 to 2027|Increasing adoption of modular UPS systems is one of the key drivers"
2023-07-06,https://www.prnewswire.com/news-releases/electronic-shift-operations-management-solutions-market-size-to-grow-by-usd-5-516-59-million-from-2022-to-2027abb-ltd-and-bmc-software-inc-emerge-as-one-of-the-key-contributors-to-growth---technavio-301869681.html,,2023-07-06 01:15:00,"Electronic Shift Operations Management Solutions Market size to grow by USD 5 , 516 . 59 million from 2022 to 2027|ABB Ltd . and BMC Software Inc . emerge as one of the key contributors to growth"
2023-07-07,https://www.tmcnet.com/usubmit/2023/07/06/9844457.htm,,2023-07-07 03:00:00,"Artificial Intelligence - as - a - Service ( AIaaS ) Market size to grow by USD 28 , 773 . 14 million from 2022 to 2027|Adoption of cloud - based solutions to drive the market"
2023-07-10,https://en.acnnewswire.com/press-release/english/85183/hitachi-rail-awarded-new-contract-to-maintain-transpennine-express-nova-1,,2023-07-10 13:00:00,
2023-07-11,https://www.prnewswire.com/news-releases/global-battery-energy-storage-market-to-reach-17-5-billion-by-2028-rapid-adoption-of-battery-energy-storage-systems-in-rural-electrification-projects-worldwide-presents-opportunities-301873032.html,,2023-07-11 02:45:00,Global Battery Energy Storage Market to Reach $17 . 5 Billion by 2028 : Rapid Adoption of Battery Energy Storage Systems in Rural Electrification Projects Worldwide Presents Opportunities
2023-07-13,https://www.globenewswire.com/news-release/2023/07/13/2704170/0/en/Data-Global-Center-Blade-Server-Market-to-Reach-33-5-Billion-by-2030-Driven-by-Growing-Demand-for-Cloud-Computing-and-Hyperscale-Data-Centers.html,,2023-07-13 11:15:00,Data Global Center Blade Server Market to Reach $33 . 5
2023-07-14,https://www.finanznachrichten.de/nachrichten-2023-07/59572963-hitachi-ltd-isuzu-elf-adopts-hitachi-astemo-sensing-system-011.htm,,2023-07-14 06:00:00,"Hitachi , Ltd .: ISUZU ELF Adopts Hitachi Astemo Sensing System"
2023-07-17,https://menafn.com/1106611948/Refrigerator-Market-Size-To-Worth-Usd-10396-Billion-By-2030-With-A-548-Cagr,,2023-07-17 08:00:00,Refrigerator Market Size To Worth Usd 103 . 96 Billion By 2030 | With A 5 . 48 % Cagr
2023-07-18,https://energy.einnews.com/pr_news/644932897/energy-storage-systems-market-revenue-to-cross-usd-73-8-bn-by-2031-registering-at-a-cagr-of-5-6-says-transparency-market-research,,2023-07-18 09:15:00,"Energy Storage Systems Market Revenue to Cross USD 73 . 8 Bn by 2031 , Registering at a CAGR of 5 . 6 % Says , Transparency Market Research"
2023-07-19,https://www.prnewswire.com/news-releases/global-smart-contact-lenses-market-report-2023-technological-advancement-in-smart-contact-lenses-drives-growth-301879780.html,,2023-07-19 00:00:00,Global Smart Contact Lenses Market Report 2023 : Technological Advancement in Smart Contact Lenses Drives Growth
2023-07-20,https://www.hometown-pages.com/centrifugal-air-compressor-market-future-outlook-and-research-studies-to-2032/,,2023-07-20 00:45:00,Centrifugal Air Compressor Market : Future Outlook and Research Studies to 2032 – Hometown Pages
2023-07-21,https://www.hometown-pages.com/air-handling-units-market-size-report-outlook-growth-key-players-revenue-and-forecast-2031/,,2023-07-21 05:45:00,"Air Handling Units Market Size , Report Outlook , Growth , Key Players , Revenue , and Forecast 2031 – Hometown Pages"
2023-07-24,https://news.yahoo.com/asia-stocks-set-open-higher-221628584.html,https://news.yahoo.com/amphtml/asia-stocks-set-open-higher-221628584.html,2023-07-24 05:30:00,Most Asian Stocks Gain as Key Rate Decisions Loom : Markets Wrap
2023-07-25,https://www.prnewswire.com/news-releases/global-light-vehicle-steering-market-to-witness-significant-growth-key-players-include-ats-automation-tooling-system-zf-friedrichshafen-ag-delphi-technologies-and-more-301883929.html,,2023-07-25 00:45:00,"Global Light Vehicle Steering Market to Witness Significant Growth , Key Players Include ATS Automation Tooling System , ZF Friedrichshafen Ag , Delphi Technologies , and More"
2023-07-26,https://www.marketscreener.com/quote/stock/HITACHI-LTD-6492458/news/Hitachi-Payment-Services-to-acquire-Writer-Corporation-s-Cash-Management-Business-44420771/,https://www.marketscreener.com/amp/quote/stock/HITACHI-LTD-6492458/news/Hitachi-Payment-Services-to-acquire-Writer-Corporation-s-Cash-Management-Business-44420771/,2023-07-26 08:15:00,Hitachi : Payment Services to acquire Writer Corporation Cash Management Business
2023-07-27,https://www.tmcnet.com/usubmit/2023/07/27/9854934.htm,,2023-07-27 05:30:00,The Thin Film Transistor ( TFT ) Liquid Crystal Display ( LCD ) Market to grow at a CAGR of 4 . 75 % from 2022 to 2027|Growing popularity of digital signage applications will drive market growth - Technavio
2023-07-28,https://www.prnewswire.com/news-releases/the-construction-dumper-market-to-grow-at-a-cagr-of-3-92-from-2021-to-2026smart-city-development-will-drive-market-growth--technavio-301887530.html,,2023-07-28 09:30:00,The Construction Dumper Market to grow at a CAGR of 3 . 92 % from 2021 to 2026|Smart city development will drive market growth - Technavio
2023-07-31,http://www.itnewsonline.com/GlobeNewswire/Automotive-Endpoint-Authentication-Market-Size-Predictions-suggest-a-rise-of-14.4Percent-CAGR-to-reach-value-of-USD-12286.3-Million-by-2032/64316,,2023-07-31 03:00:00,"Automotive Endpoint Authentication Market Size Predictions suggest a rise of 14 . 4 % CAGR to reach value of USD 12 , 286 . 3 Million by 2032"
2023-08-01,https://www.prnewswire.com/news-releases/global-fluoroscopy-equipment-markets-trends-opportunity-and-forecasts-2028f-301890242.html,,2023-08-01 17:30:00,"Global Fluoroscopy Equipment Markets , Trends , Opportunity and Forecasts , 2028F"
2023-08-02,https://whatech.com/og/markets-research/industrial/753389-global-ac-drive-market-global-industry-analysis-size-share-growth-trends-regional-outlook-and-forecast-2023-2030,https://whatech.com/og/markets-research/industrial/753389-global-ac-drive-market-global-industry-analysis-size-share-growth-trends-regional-outlook-and-forecast-2023-2030/amp,2023-08-02 00:15:00,"Global AC Drive Market : global industry analysis , size , share , growth , trends , regional outlook , and forecast 2023 - 2030"
2023-08-04,https://www.globenewswire.com/news-release/2023/08/04/2718718/0/en/Metal-Cutting-Tools-Market-to-Surpass-106-5-Billion-by-2030-Drives-Due-to-Increasing-Demand-for-Industrial-Machinery.html,,2023-08-04 04:00:00,Metal Cutting Tools Market to Surpass 106 . 5 Billion by 2030
2023-08-07,https://www.fmiblog.com/2023/08/06/household-appliances-market-on-the-rise-exploring-key-factors-driving-industry-growth-2033-fmi/,,2023-08-07 00:30:00,Household Appliances Market on the Rise : Exploring Key Factors Driving Industry Growth 2033 | FMI
2023-08-08,https://itbusinessnet.com/2023/08/matsuyama-mikan-energy-selects-hitachis-grid-energy-storage-system-with-e-mesh-powerstore/,https://itbusinessnet.com/2023/08/matsuyama-mikan-energy-selects-hitachis-grid-energy-storage-system-with-e-mesh-powerstore/amp/,2023-08-08 04:45:00,Matsuyama Mikan Energy selects Hitachi grid energy storage system with e - mesh PowerStore
2023-08-09,https://www.fmiblog.com/2023/08/09/unveiling-growth-compact-wheel-loaders-market-projected-to-surpass-6-3-billion-by-2033-with-a-5-04-cagr/,,2023-08-09 05:30:00,Unveiling Growth : Compact Wheel Loaders Market Projected to Surpass $6 . 3 Billion by 2033 with a 5 . 04 % CAGR
2023-08-10,https://menafn.com/1106825846/2023-Global-QuotInsulated-Gate-Bipolar-Transistors-MarketQuot-Report-With-SWOT-Study-And-Competitive-Analysis-Forecast-2030-With-116-Pages-By-IRB,,2023-08-10 09:45:00,"2023 Global  Insulated - Gate Bipolar Transistors Market  Report With SWOT Study And Competitive Analysis , Forecast 2030 | With 116+ Pages By ... "
2023-08-14,https://www.globenewswire.com/news-release/2023/08/13/2724030/0/en/Dry-Type-Distribution-Transformer-Market-Meeting-Rising-Energy-Demands-Propels-Growth-at-CAGR-6-1-Value-Set-to-Reach-USD-11-2-Billion-by-2032.html,,2023-08-14 00:15:00,Dry Type Distribution Transformer Market : Meeting Rising
2023-08-15,https://www.prnewswire.com/news-releases/permanent-magnets-market-to-grow-at-a-cagr-of-10-10-from-2021-to-2026-the-increasing-demand-from-the-automobile-sector-to-boost-market-growth---technavio-301899039.html,,2023-08-15 02:45:00,Permanent Magnets Market to grow at a CAGR of 10 . 10 % from 2021 to 2026 ; The increasing demand from the automobile sector to boost market growth
2023-08-16,https://www.globenewswire.com/news-release/2023/08/16/2726140/0/en/Competitive-Edge-in-the-Forensic-Imaging-Market-Leading-Players-and-Innovations-Explored-2023-2030.html,,2023-08-16 10:15:00,Competitive Edge in the Forensic Imaging Market : Leading
2023-08-17,https://www.prnewswire.com/news-releases/semiconductor-packaging-materials-market-to-grow-by-usd-10-158-72-million-from-2022-to-2027-the-rise-in-global-demand-for-consumers-drives-growth---technavio-301903498.html,,2023-08-17 23:45:00,"Semiconductor packaging materials market to grow by USD 10 , 158 . 72 million from 2022 to 2027 ; The rise in global demand for consumers drives growth"
2023-08-18,https://www.tmcnet.com/usubmit/2023/08/17/9866793.htm,,2023-08-18 00:15:00,"Semiconductor packaging materials market to grow by USD 10 , 158 . 72 million from 2022 to 2027 ; The rise in global demand for consumers drives growth"
2023-08-21,https://finance.yahoo.com/news/synchronous-condenser-market-hit-usd-233000028.html,https://finance.yahoo.com/amphtml/news/synchronous-condenser-market-hit-usd-233000028.html,2023-08-21 00:30:00,"Synchronous Condenser Market to hit USD 2 . 2 Bn by 2032 , Says Global Market Insights Inc . "
2023-08-22,https://www.prnewswire.com/news-releases/enterprise-flash-storage-market-to-grow-by-usd-7-97-billion-from-2022-to-2027--the-increasing-demand-for-high-performance-storage-solutions-drives-the-market---technavio-301905894.html,,2023-08-22 01:30:00,Enterprise Flash Storage Market to grow by USD 7 . 97 billion from 2022 to 2027 | The increasing demand for high - performance storage solutions drives the market
2023-08-23,https://www.globenewswire.com/news-release/2023/08/23/2730507/0/en/Building-Energy-Management-System-Market-is-anticipated-to-reach-USD-15-9-Billion-by-2032-at-a-13-20-CAGR-during-the-forecast-period-2023-2032.html,,2023-08-23 13:45:00,Building Energy Management System Market is anticipated to
2023-08-24,https://www.globenewswire.com/news-release/2023/08/24/2730862/0/en/Navigating-the-Future-of-Global-Positive-Displacement-Motor-Market-Unveil-Growth-Opportunities-with-In-depth-Insights.html,,2023-08-24 08:45:00,Navigating the Future of Global Positive Displacement Motor
2023-08-25,https://www.newyorktelegraph.com/news/273943559/lithium-ion-batteries-market-to-grow-exponentially-driven-by-rising-electric-vehicle-ev-adoption-and-advancements-in-battery-technology,,2023-08-25 14:45:00,Lithium - Ion Batteries Market to Grow Exponentially Driven by Rising Electric Vehicle ( EV ) Adoption and Advancements in Battery Technology
2023-08-28,https://menafn.com/1106971801/Center-Break-Disconnector-Market-2023-Demand-Share-Growing-2030,,2023-08-28 01:30:00,"Center Break Disconnector Market 2023 Demand , Share , Growing 2030"
2023-08-29,https://www.dailypolitical.com/2023/08/28/short-interest-in-hitachi-ltd-otcmktshthiy-grows-by-147-1.html,,2023-08-29 00:45:00,"Short Interest in Hitachi , Ltd . ( OTCMKTS : HTHIY ) Grows By 147 . 1 % "
2023-08-30,https://www.globenewswire.com/news-release/2023/08/30/2734562/0/en/The-Global-Clinical-Chemistry-Analyzers-Market-size-is-expected-to-reach-16-1-billion-by-2030-rising-at-a-market-growth-of-5-2-CAGR-during-the-forecast-period.html,,2023-08-30 15:15:00,The Global Clinical Chemistry Analyzers Market size is
2023-08-31,https://www.oann.com/business/boj-policymaker-nakamura-warns/,,2023-08-31 04:15:00,BOJ policymaker Nakamura warns against premature monetary tightening
2023-09-01,https://www.prnewswire.com/news-releases/harvesting-power-for-progress-global-energy-harvesting-equipment-market-2023-2032-fueled-by-clean-energy-demands-301914838.html,,2023-09-01 00:45:00,"Harvesting Power for Progress : Global Energy Harvesting Equipment Market 2023 - 2032 , Fueled by Clean Energy Demands"
2023-09-04,https://www.prnewswire.com/news-releases/leading-the-way-americas-spearhead-growth-in-the-global-microgrid-market-to-2028-301916850.html,,2023-09-04 16:45:00,Leading the Way : Americas Spearhead Growth in the Global Microgrid Market to 2028
2023-09-05,https://www.tmcnet.com/usubmit/2023/09/04/9874234.htm,,2023-09-05 04:30:00,User Provisioning Market to grow by USD 2 . 3884 billion from 2022 to 2027 | Growing demand for mobile user provisioning software boosts the market growth
2023-09-06,https://en.acnnewswire.com/press-release/english/86347/hitachi-introduction-of-a-full-digital-substation-system,,2023-09-06 06:00:00,
2023-09-07,https://www.insideindianabusiness.com/articles/holcomb-to-lead-economic-development-trip-to-japan,,2023-09-07 00:45:00,Holcomb to lead economic development trip to Japan – Inside INdiana Business
2023-09-08,https://www.tribstar.com/news/local_news/indiana-gov-holcomb-leading-weeklong-foreign-trade-mission-to-japan-beginning-thursday/article_aa31ca61-fd9f-5732-96eb-d52b546283d8.html,,2023-09-08 01:30:00,Indiana Gov . Holcomb leading weeklong foreign trade mission to Japan beginning Thursday
2023-09-12,https://www.benzinga.com/pressreleases/23/09/g34463959/automotive-performance-accessories-market-to-surpass-us-546-4-million-by-2033-future-market-insigh,https://www.benzinga.com/amp/content/34463959,2023-09-12 01:30:00,"Automotive Performance Accessories Market to surpass US$ 546 . 4 million by 2033 | Future Market Insights , Inc . "
2023-09-13,https://www.prnewswire.com/news-releases/elevator-and-escalator-market-to-grow-by-usd-60-75-billion-from-2022-to-2027--growing-investment-in-smart-cities-to-drive-the-growth--technavio-301925369.html,,2023-09-13 02:30:00,Elevator and Escalator Market to grow by USD 60 . 75 billion from 2022 to 2027 | Growing investment in smart cities to drive the growth - Technavio
2023-09-14,https://www.manmonthly.com.au/taking-compressed-air-solutions-to-new-heights/,,2023-09-14 06:15:00,Taking compressed air solutions to new heights - Manufacturer Monthly
2023-09-18,https://www.tmcnet.com/usubmit/2023/09/18/9882976.htm,,2023-09-18 23:15:00,Hironori Washizaki Elected IEEE Computer Society 2025 President
2023-09-19,https://menafn.com/1107094651/Semiconductors-Market-In-Vietnam-2022-To-2027-The-Rapid-Adoption-Of-Smartphones-Drives-Market-Growth,,2023-09-19 05:00:00,Semiconductors Market In Vietnam - 2022 To 2027 | The Rapid Adoption Of Smartphones Drives Market Growth
2023-09-20,https://www.prnewswire.com/news-releases/projectors-market-thrives-on-innovation-technological-advancements-drive-growth-with-education-sector-fueling-demand-301932326.html,,2023-09-20 00:45:00,"Projectors Market Thrives on Innovation : Technological Advancements Drive Growth , with Education Sector Fueling Demand"
2023-09-21,https://www.prnewswire.com/news-releases/all-flash-array-market-to-grow-by-usd-31-03-billion-between-2022---2027--growth-driven-by-increasing-adoption-of-ssds-in-laptops-gaming-and-high-end-pcs---technavio-301933879.html,,2023-09-21 01:45:00,"All Flash Array Market to grow by USD 31 . 03 billion between 2022 - 2027 | Growth Driven by Increasing Adoption of SSDs in laptops , gaming , and high - end PCs"
2023-09-22,https://whatech.com/og/markets-research/industrial/755854-asia-pacific-factory-automation-market-to-signify-strong-growth-by-2023-2029-according-to-a-new-research-report,https://whatech.com/og/markets-research/industrial/755854-asia-pacific-factory-automation-market-to-signify-strong-growth-by-2023-2029-according-to-a-new-research-report/amp,2023-09-22 02:15:00,Asia - Pacific Factory Automation Market to signify strong growth by ( 2023 - 2029 ) according to a new research report
2023-09-25,https://executivegov.com/articles/5-cloud-computing-companies-surging-the-digital-storm-in-2023/,,2023-09-25 04:45:00,5 Cloud Computing Companies Surging the Digital Storm in 2023
2023-09-26,https://www.prnewswire.com/news-releases/electron-microscopy-sample-preparation-market-to-grow-by-usd-244-64-million-from-2022-2027--asia-to-account-for-41-of-market-growth---technavio-301937670.html,,2023-09-26 04:00:00,Electron Microscopy Sample Preparation Market to grow by USD 244 . 64 million from 2022 - 2027 | Asia to account for 41 % of market growth
2023-09-27,https://www.prnewswire.com/news-releases/global-data-center-support-infrastructure-strategic-business-report-2023-2030-featuring-abb-eaton-huawei-hp-hitachi-and-more-301939246.html,,2023-09-27 00:45:00,"Global Data Center Support Infrastructure Strategic Business Report 2023 - 2030 Featuring ABB , Eaton , Huawei , HP , Hitachi , and More"
2023-09-28,https://www.tmcnet.com/usubmit/2023/09/27/9889039.htm,,2023-09-28 02:00:00,"Railway Wiring Harness Market size to grow by USD 443 . 29 million from 2022 to 2027 , Growing demand for efficient and reliable transportation systems boosts the market growth"
2023-09-29,https://www.prnewswire.com/news-releases/germany---it-market-size-to-usd-30-34-billion-growth-between-2022---2027--driven-by-increased-adoption-of-it-solutions-among-german-smes---technavio-301942053.html,,2023-09-29 06:00:00,"Germany - IT Market size to USD 30 . 34 billion growth between 2022 - 2027 , Driven by Increased adoption of IT solutions among German SMEs"
2023-10-02,https://www.marketscreener.com/quote/stock/HITACHI-LTD-6492458/news/Continental-Automotive-Honors-GlobalLogic-with-Supplier-of-the-Year-Award-44963956/,,2023-10-02 12:30:00,Continental Automotive Honors GlobalLogic with Supplier of the Year Award
2023-10-04,https://www.tmcnet.com/usubmit/2023/10/03/9892236.htm,,2023-10-04 03:45:00,"Automotive Stereo Camera Market size to grow by USD 534 . 29 million from 2022 to 2027 | The market is fragmented due to the presence of prominent companies like Autoliv Inc ., Continental AG & DENSO Corp ., and many more"
2023-10-05,https://brazilbusiness.einnews.com/pr_news/659546367/advancements-in-fermenters-market-swot-analysis-by-key-players-hitachi-samsung-whirlpool-panasonic-ab-electrolux,https://brazilbusiness.einnews.com/amp/pr_news/659546367/advancements-in-fermenters-market-swot-analysis-by-key-players-hitachi-samsung-whirlpool-panasonic-ab-electrolux,2023-10-05 04:00:00,"Advancements in Fermenters Market SWOT Analysis by Key Players - Hitachi , Samsung , Whirlpool , Panasonic , AB Electrolux"
2023-10-06,https://www.finanznachrichten.de/nachrichten-2023-10/60304858-automotive-electronics-market-forecast-2023-2027-estimated-market-size-growth-drivers-and-lucrative-segment-by-the-business-research-company-008.htm,,2023-10-06 15:00:00,"Automotive Electronics Market Forecast 2023 - 2027 : Estimated Market Size , Growth Drivers And Lucrative Segment"
2023-10-10,https://www.prnewswire.com/news-releases/uk---high-voltage-direct-current-hvdc-transmission-systems-market-to-grow-by-usd-363-9-million-during-2022-2027--increasing-demand-for-power-to-drive-the-growth---technavio-301951084.html,,2023-10-10 03:00:00,UK - High Voltage Direct Current ( HVDC ) Transmission Systems Market to grow by USD 363 . 9 million during 2022 - 2027 | Increasing demand for power to drive the growth
2023-10-11,"https://itwire.com/guest-articles/company-news/hitachi-vantara-unveils-hitachi-virtual-storage-platform-one,-signifying-a-new-hybrid-cloud-approach-to-data-storage.html",,2023-10-11 05:00:00,"iTWire - Hitachi Vantara Unveils Hitachi Virtual Storage Platform One , Signifying a New Hybrid Cloud Approach to Data Storage"
2023-10-12,https://en.acnnewswire.com/press-release/english/87001/hitachi-announces-consolidation-of-healthcare-business-into-hitachi-high-tech-through-company-split,,2023-10-12 07:00:00,
2023-10-13,https://energy.einnews.com/pr_news/661375026/consumer-electronics-batteries-market-size-is-expected-to-reach-61-3-billion-by-2032-growing-at-a-cagr-of-16-2,https://energy.einnews.com/amp/pr_news/661375026/consumer-electronics-batteries-market-size-is-expected-to-reach-61-3-billion-by-2032-growing-at-a-cagr-of-16-2,2023-10-13 05:30:00,Consumer Electronics Batteries Market Size is Expected to Reach $61 . 3 billion by 2032 | Growing at a CAGR of 16 . 2 % 
2023-10-16,https://www.bnnbloomberg.ca/time-to-short-japan-s-bad-governance-stocks-hedge-fund-says-1.1985003,https://www.bnnbloomberg.ca/time-to-short-japan-s-bad-governance-stocks-hedge-fund-says-1.1985003.amp.html,2023-10-16 04:30:00,"Time to Short Japan  Bad Governance  Stocks , Hedge Fund Says"
2023-10-17,https://www.prnewswire.com/news-releases/fiber-optics-market-to-increase-by-usd-3-6-billion-from-2022-to-2027--rising-smart-city-initiatives-drive-the-market---technavio-301958101.html,,2023-10-17 02:30:00,Fiber Optics Market to increase by USD 3 . 6 billion from 2022 to 2027 | Rising smart city initiatives drive the market
2023-10-18,https://www.prnewswire.com/news-releases/global-pancreatic-cancer-diagnostic-market-set-to-reach-usd-3-90-billion-by-2030-with-a-cagr-of-6-53-301959548.html,,2023-10-18 00:00:00,Global Pancreatic Cancer Diagnostic Market Set to Reach USD 3 . 90 Billion by 2030 with a CAGR of 6 . 53 % 
2023-10-19,https://southafricatoday.net/business/partnership-forged-to-accelerate-the-energy-transition-hitachi-energy-and-google-cloud-combine-energy-and-digi-tal-expertise-to-advance-sustainability-initiatives/,,2023-10-19 00:45:00,Partnership Forged to Accelerate the Energy Transition : Hitachi Energy and Google Cloud Combine Energy and Digi - tal Expertise to Advance Sustainability Initiatives
2023-10-20,https://www.fmiblog.com/2023/10/20/precision-cancer-imaging-market-is-poised-for-substantial-expansion-projected-to-reach-us-210-58-billion-by-2032/,,2023-10-20 03:15:00,"Precision Cancer Imaging Market is poised for substantial expansion , projected to reach US$ 210 . 58 Billion by 2032"
2023-10-24,https://www.marketscreener.com/quote/stock/HITACHI-LTD-6492458/news/Hitachi-Energy-acquires-eks-Energy-45130626/,,2023-10-24 06:15:00,Hitachi Energy acquires eks Energy
2023-10-25,https://english.kyodonews.net/news/2023/10/1c043c919a05-chip-device-firm-kokusai-electrics-shares-jump-on-tokyo-bourse-debut.html,,2023-10-25 05:30:00,Chip device firm Kokusai Electric shares jump on Tokyo bourse debut
2023-10-26,https://www.legalbusinessonline.com:443/features/rankings-alb-asia-40-under-40,,2023-10-26 10:00:00,Rankings : ALB Asia 40 Under 40 | Asian Legal Business
2023-10-27,https://menafn.com/1107318286/Automotive-Wiring-Harness-Market-To-Envision-A-Market-Valuation-Of-US-8646-Billion-By-2031-With-A-CAGR-Of-732,,2023-10-27 11:45:00,"Automotive Wiring Harness Market To Envision A Market Valuation Of US$ 86 . 46 Billion By 2031 , With A CAGR Of 7 . 32 % "
