QueryDate,URL,MobileURL,Date,Title
2019-01-01,https://www.pr-inside.com/cardiac-ultrasound-systems-market-r4719777.htm,,2019-01-01 13:30:00,Cardiac Ultrasound Systems Market
2019-01-02,https://www.medgadget.com/2019/01/radiotherapy-market-foreseen-to-witness-fabulous-growth-by-2023-expected-to-reach-at-7-cagr.html,,2019-01-02 11:00:00,Radiotherapy Market Foreseen to Witness Fabulous Growth by 2023 | Expected to Reach at 7 % CAGR |
2019-01-03,http://www.eweek.com/big-data-and-analytics/eweek-s-top-companies-cloud-data-center-storage,,2019-01-03 00:30:00,"eWEEK Top Companies : Cloud , Data Center Storage"
2019-01-04,https://mainichi.jp/english/articles/20190104/p2a/00m/0bu/030000c,,2019-01-04 10:30:00,Japanese govt plan to export nuclear power technology floundering
2019-01-07,https://www.pr-inside.com/diagnostic-imaging-devices-market-to-reach-usd-35--r4721400.htm,,2019-01-07 06:15:00,"Diagnostic Imaging Devices Market to Reach USD 35 , 793 . 4 million by 2020"
2019-01-08,https://www.prnewswire.com/news-releases/microgrid-monitoring-systems-market-report-2019-2029-300773933.html,,2019-01-08 00:30:00,Microgrid Monitoring Systems Market Report 2019 - 2029
2019-01-09,https://www.pr-inside.com/global-cloud-equipment-market-revenue-to-witness-r-r4723521.htm,,2019-01-09 10:30:00,Global Cloud Equipment Market Revenue to Witness Rapid Growth in the Near Future
2019-01-10,https://www.ssuchronicle.com/2019/01/10/global-ct-scanners-market-is-grow-at-a-cagr-of-8-6-and-expected-to-reach-usd-8-67-billion-by-2026-from-usd-4-12-billion-in-2017/,,2019-01-10 04:00:00,Global CT Scanners Market Is Grow at a CAGR of 8 . 6 % and Expected to Reach USD 8 . 67 Billion by 2026 from USD 4 . 12 Billion in 2017
2019-01-11,https://uk.reuters.com/article/uk-hitachi-nuclear/hitachi-to-suspend-uk-nuclear-power-ops-post-2-billion-special-loss-nikkei-idUKKCN1P505Y,https://uk.mobile.reuters.com/article/amp/idUKKCN1P505Y,2019-01-11 03:00:00,"Hitachi to suspend united kingdom nuclear power ops , post $2 billion special loss - Nikkei"
2019-01-14,https://www.businesswire.com/news/home/20190114005355/en/Light-Vehicle-OE-Shock-Absorbers-Market--,,2019-01-14 11:15:00,Light Vehicle OE Shock Absorbers Market - Worldwide Forecasts to 2033 : Major Companies & Technologies - ResearchAndMarkets . com
2019-01-15,https://www.fairfieldcurrent.com/news/2019/01/15/nxp-semiconductors-nxpi-summit-wireless-technologies-wisa-head-to-head-review.html,https://www.fairfieldcurrent.com/news/2019/01/15/nxp-semiconductors-nxpi-summit-wireless-technologies-wisa-head-to-head-review.html/amp,2019-01-15 02:45:00,NXP Semiconductors ( NXPI ) & Summit Wireless Technologies ( WISA ) Head - To - Head Review
2019-01-16,http://www.comunicati.net/comunicati/aziende/editoria/516054.html,,2019-01-16 07:45:00,"Radiotherapy Market By Key Manufacturers , By Product Type ( External Beam Therapy , Internal Beam Therapy ), By Type ( External Beam , Internal Beam , Systemic ), By End - User ( Hospitals , Independent Radiotherapy Centers ) and By Region ( North A..."
2019-01-17,https://uk.reuters.com/article/us-hitachi-nuclear/hitachi-freezes-british-nuclear-project-books-2-8-billion-hit-idUKKCN1PB0RV,https://uk.mobile.reuters.com/article/amp/idUKKCN1PB0RV,2019-01-17 09:45:00,"Hitachi freezes British nuclear project , books $2 . 8 billion hit"
2019-01-18,https://www.reuters.com/article/britain-press-ft/press-digest-financial-times-jan-18-idUSL3N1ZI06O,https://mobile.reuters.com/article/amp/idUSL3N1ZI06O,2019-01-18 01:45:00,PRESS DIGEST - Financial Times - Jan 18
2019-01-21,https://mainichi.jp/english/articles/20190119/p2a/00m/0bu/012000c,,2019-01-21 04:00:00,TEPCO chief calls for realignment of nuclear power businesses
2019-01-22,https://menafn.com/1098006310/Air-Compressor-2019-Global-Opportunity-Analysis-And-Industry-Forecasts-To-2023,,2019-01-22 05:45:00,Air Compressor 2019 Global Opportunity Analysis And Industry Forecasts To 2023
2019-01-23,https://www.marketwatch.com/press-release/entergy-texas-and-mhps-bring-a-change-in-power-to-texas-as-they-move-forward-on-a-new-993-mw-power-plant-2019-01-22,,2019-01-23 00:15:00,Entergy Texas and MHPS Bring a  Change in Power  to Texas as They Move Forward on a New 993 MW Power Plant
2019-01-24,https://www.openpr.com/news/1528502/Escalating-Demand-for-Automated-Breast-Ultrasound-System-Market-Influences-Market-Growth-during-2017-2026-By-GE-Healthcare-Delphinus-Medical-Technologies-Inc-Siemens-AG-SonoCine-Inc-etc.html,,2019-01-24 07:30:00,"Escalating Demand for Automated Breast Ultrasound System Market Influences Market Growth during 2017 - 2026 | By GE Healthcare , Delphinus Medical Technologies Inc ., Siemens AG , SonoCine Inc ., etc . "
2019-01-25,https://www.reuters.com/article/britain-press-ft/press-digest-financial-times-jan-25-idUSL1N1ZP01N,https://mobile.reuters.com/article/amp/idUSL1N1ZP01N,2019-01-25 02:15:00,PRESS DIGEST - Financial Times - Jan 25
2019-01-28,https://tech.nikkeibp.co.jp/dm/atclen/news_en/15mk/012602635/,,2019-01-28 05:30:00,Prologis to Install 2 . 5MW Rooftop Solar Plant in Kyoto - News - Solar Power Plant Business
2019-01-29,https://renewablesnow.com/news/hitachi-bets-on-marketing-enercon-wind-turbines-om-ramp-up-640679/,,2019-01-29 01:45:00,"Hitachi bets on marketing Enercon wind turbines , O & M ramp - up"
2019-01-30,https://www.prweb.com/releases/hitachi_solutions_america_rebrands_ecommerce_products_to_better_reflect_client_needs_market_changes_and_product_growth/prweb16066594.htm,,2019-01-30 00:00:00,"Hitachi Solutions America Rebrands Ecommerce Products to Better Reflect Client Needs , Market Changes , and Product Growth"
2019-01-31,http://www.sbwire.com/press-releases/release-1135203.htm,http://www.sbwire.com/press-releases/amp/release-1135203.htm,2019-01-31 00:45:00,Traffic and Billing Management Solution Market Report : What Are the Key Challenges to the Market Growth ? 
2019-02-01,https://www.marketwatch.com/press-release/global-software-defined-data-center-market-segmentation-parameters-and-prospects-2019-to-2025-market-research-report-2019-02-01,,2019-02-01 10:00:00,"Global Software - Defined Data Center Market Segmentation , Parameters and Prospects 2019 to 2025 Market Research Report"
2019-02-04,"http://www.jcnnewswire.com/pressrelease/49487/3/Hitachi-to-Strengthen-Business-Structures-for-a-Transformation-into-a-Global-Leader,-as-Laid-Out-in-",,2019-02-04 01:45:00,"Hitachi to Strengthen Business Structures for a Transformation into a Global Leader , as Laid Out in the 2021 Mid - term Management Plan"
2019-02-05,https://www.businesswire.com/news/home/20190204005773/en/Sir-George-Buckley-Joins-eGym-Chairman,,2019-02-05 00:30:00,Sir George Buckley Joins eGym as Chairman
2019-02-06,https://www.whatech.com/market-research/it/562263-iot-middleware-market-to-reach-us-19-5-billion-growing-at-cagr-23-0-to-2023,https://www.whatech.com/market-research/it/562263-iot-middleware-market-to-reach-us-19-5-billion-growing-at-cagr-23-0-to-2023/amp,2019-02-06 08:30:00,IoT Middleware market to reach US$ 19 . 5 billion growing at CAGR 23 . 0 % to 2023 insights shared in detailed report
2019-02-07,http://markets.financialcontent.com/stocks/news/read?GUID=37712641,,2019-02-07 00:30:00,The global magnetic resonance imaging ( MRI ) systems market is expected to grow at a CAGR of 6 . 5 % 
2019-02-08,https://www.marketwatch.com/press-release/electric-motors-market-share-to-touch-us-134-billion-by-2022-2019-02-07,,2019-02-08 04:15:00,Electric Motors Market Share to Touch US$ 134 billion by 2022
2019-02-11,https://www.prweb.com/releases/hitachi_solutions_asia_pacific_to_showcase_microsoft_dynamics_cloud_erp_for_a_seamless_and_systematic_organization/prweb16093279.htm,,2019-02-11 00:00:00,Hitachi Solutions Asia Pacific to Showcase Microsoft Dynamics Cloud ERP for a Seamless and Systematic Organization
2019-02-12,https://www.reuters.com/article/japan-stocks-midday-idUSL3N2071GH,https://mobile.reuters.com/article/amp/idUSL3N2071GH,2019-02-12 03:15:00,"Nikkei rebounds from 3 - week low as automakers , machinery stocks gain"
2019-02-13,https://www.tmcnet.com/usubmit/2019/02/12/8898298.htm,,2019-02-13 02:00:00,Software Defined Infrastructure Market Research Report by Forecast to 2023
2019-02-14,https://us.hitachi-solutions.com/blog/hitachi-solutions-america-launches-engage-products-for-asset-management-and-private-equity/,,2019-02-14 01:30:00,Hitachi Solutions America Launches Engage Products for Asset Management and Private Equity
2019-02-15,https://www.marketwatch.com/investing/stock/5486,,2019-02-15 02:30:00,5486 Stock Price - Hitachi Metals Ltd . Stock Quote ( Japan : Tokyo ) 
2019-02-18,https://www.pr-inside.com/email-applications-market-is-expected-to-expand-at-r4743611.htm,,2019-02-18 06:30:00,Email Applications Market is expected to expand at a CAGR of 4 . 1 % during 2015 - 2020
2019-02-19,https://www.prnewswire.com/news-releases/the-global-data-center-cooling-market-size-is-expected-to-reach-usd-20-7-billion-by-2025-expanding-at-a-cagr-of-13-5-300797255.html,,2019-02-19 00:00:00,The global data center cooling market size is expected to reach USD 20 . 7 billion by 2025 expanding at a CAGR of 13 . 5 % 
2019-02-20,http://www.jcnnewswire.com/pressrelease/49785/3/Prince-of-Songkla-University-(Thailand)-and-Hitachi-Jointly-Develop-Sentiment-Analysis-Engine-for-Th,,2019-02-20 07:45:00,Prince of Songkla University ( Thailand ) and Hitachi Jointly Develop Sentiment Analysis Engine for Thai Language
2019-02-21,https://www.marketscreener.com/HITACHI-LTD-6492458/news/Hitachi-February-21-2019Hitachi-and-Hitachi-Capital-Received-an-Order-for-Seawater-RO-Desalinatio-28041623/,https://www.marketscreener.com/amp/HITACHI-LTD-6492458/news/Hitachi-February-21-2019Hitachi-and-Hitachi-Capital-Received-an-Order-for-Seawater-RO-Desalinatio-28041623/,2019-02-21 04:30:00,"Hitachi : February 21 , 2019Hitachi and Hitachi Capital Received an Order for Seawater RO Desalination System with Financing for Water Supply Infrastructure Project in the Maldives"
2019-02-22,https://whatsonthorold.com/2019/02/21/can-dsv-a-s-ordinary-shares-denmark-otcmktsdsdvfs-tomorrow-be-different-the-stock-had-increase-in-shorts/,,2019-02-22 01:45:00,Can DSV A / S ORDINARY SHARES DENMARK ( OTCMKTS : DSDVF ) Tomorrow be Different ? The Stock Had Increase in Shorts
2019-02-25,https://www.pr-inside.com/rising-adoption-of-railways-management-system-mark-r4746232.htm,,2019-02-25 02:15:00,Rising Adoption of Railways Management System Market to Fuel Revenue Growth Through 2022
2019-02-26,https://www.pr-inside.com/global-5g-network-equipment-market-to-exhibit-incr-r4746883.htm,,2019-02-26 00:45:00,Global 5G Network Equipment Market to Exhibit Increased Demand in the Coming Years
2019-02-27,https://www.pr-inside.com/qyresearch-latest-trends-in-petct-systems-market-r4747543.htm,,2019-02-27 03:45:00,QYResearch : Latest Trends in PET / CT Systems Market 2019 - 2025
2019-02-28,http://en.acnnewswire.com/press-release/english/49972/hitachi-new-clinical-study-tests-pharmacotherapy-selection-system-aims-to-improve-the-impact-of-diabetes-treatment,,2019-02-28 02:15:00,
2019-03-01,https://marketersmedia.com/projections-of-global-smart-cities-market-by-2019-2025-key-players-type-region-manufactures/487460,,2019-03-01 06:15:00,"Projections of Global Smart Cities Market by 2019 - 2025 : Key Players , Type , Region , Manufactures « MarketersMEDIA – Press Release Distribution Services – News Release Distribution Services"
2019-03-04,http://www.jcnnewswire.com/pressrelease/50086/3/Hitachi-to-Strengthen-Business-Structures-by-Integrating-Five-Group-Companies,,2019-03-04 12:45:00,Hitachi to Strengthen Business Structures by Integrating Five Group Companies
2019-03-05,https://www.investegate.co.uk/hitachi-vantara-corporation/gnw/hitachi-vantara-doubles-down-on-partner-business--drives-growth-across-robust-ecosystem/20190304220000H3315/,,2019-03-05 00:30:00,"FE Investegate |Hitachi Vantara Corporation Announcements | Hitachi Vantara Corporation : Hitachi Vantara Doubles Down on Partner Business , Drives Growth Across Robust Ecosystem"
2019-03-06,http://www.china.org.cn/business/2019-03/06/content_74537284.htm,,2019-03-06 03:30:00,Hitachi under fire for illegal treatment of foreign trainees
2019-03-07,http://www.acnnewswire.com/Article.Asp?Art_ID=50147&lang=EN,,2019-03-07 02:15:00,Hitachi to Extend Tender Offer Period for Shares of Yungtay
2019-03-08,https://siliconangle.com/2019/03/07/okta-buys-workflow-automation-startup-azqua/,,2019-03-08 04:30:00,Okta buys workflow automation startup Azuqua for $52 . 5M
2019-03-11,https://in.reuters.com/article/us-hitachi-chem-stocks/hitachi-chemical-flooded-with-buy-orders-on-report-of-sale-idINKBN1QS0BZ,https://in.mobile.reuters.com/article/amp/idINKBN1QS0BZ,2019-03-11 05:30:00,Hitachi Chemical flooded with buy orders on report of sale
2019-03-12,http://www.jcnnewswire.com/pressrelease/50261/3/MHPS-H-100-Gas-Turbine-Gains-Momentum-with-Multiple-Qualifications,,2019-03-12 06:30:00,MHP H - 100 Gas Turbine Gains Momentum with Multiple Qualifications
2019-03-13,http://en.acnnewswire.com/press-release/english/50283/hitachi-automotive-systems-to-strengthen-its-global-organizational-structure,,2019-03-13 00:45:00,
2019-03-14,https://www.pr-inside.com/significant-growth-foreseen-by-automotive-mems-sen-r4751770.htm,,2019-03-14 09:00:00,Significant Growth Foreseen by Automotive MEMS Sensor Market During 2028
2019-03-15,http://www.digitaljournal.com/pr/4208875,,2019-03-15 05:30:00,"Split Air Conditioning Systems Market to Reach US $186 , 574 . 2 Mn by 2026 : Key Players : Daikin Industries , Ltd ., United Technologies Corp ., Hitachi , Ltd - Press Release"
2019-03-18,https://www.prnewswire.com:443/news-releases/the-global-market-for-gpon-equipment-2019---the-rising-demand-for-better-quality-fiber-network-architecture-is-propelling-growth-300813277.html,,2019-03-18 11:00:00,"The Global Market for GPON Equipment , 2019 - The Rising Demand for Better Quality Fiber Network Architecture is Propelling Growth"
2019-03-19,https://www.ssuchronicle.com/2019/03/19/urology-ultrasound-market-growth-strategies-and-comprehensive-forecast-to-2026/,,2019-03-19 02:45:00,Urology Ultrasound Market Growth Strategies and Comprehensive Forecast to 2026
2019-03-20,http://www.jcnnewswire.com/pressrelease/50452/3/Hitachi-Launches-&quotLumada-Solution-Hub&quot-to-Advance-and-Facilitate-Introduction-of-Lumada-Solu,,2019-03-20 02:30:00,Hitachi Launches  Lumada Solution Hub  to Advance and Facilitate Introduction of Lumada Solutions
2019-03-21,https://www.openpr.com/news/1665635/Europe-Radiotherapy-Market-2019-Competitor-Analysis-by-Varian-Medical-Systems-Elekta-Accuray-CIVCO-Medical-Solutions-Brainlab-CR-Bard-Nordion-RaySearch-Laboratories.html,,2019-03-21 07:00:00,"Europe Radiotherapy Market 2019 Competitor Analysis by Varian Medical Systems , Elekta , Accuray , CIVCO Medical Solutions , Brainlab , CR Bard , Nordion , RaySearch Laboratories"
2019-03-22,http://www.jcnnewswire.com/pressrelease/50526/3/Hitachi:-AI-Technology-for-Quantifying-Physical-Load-and-Providing-Effective-Feedbacks-Using-Sensor-,,2019-03-22 02:45:00,Hitachi : AI Technology for Quantifying Physical Load and Providing Effective Feedbacks Using Sensor Suit Devices
2019-03-25,https://news.yahoo.com/focus-apples-iphone-struggles-unravel-230000172.html,https://news.yahoo.com/amphtml/focus-apples-iphone-struggles-unravel-230000172.html,2019-03-25 00:15:00,FOCUS - Apple iPhone struggles unravel ambitions of Japan Display
2019-03-26,https://www.ssuchronicle.com/2019/03/26/interactive-whiteboard-market-key-players-smart-technologies-inc-promethean-world-plc-hitachi-ltd-panasonic-corporation-steelcase-inc-others/,,2019-03-26 03:15:00,"Interactive Whiteboard Market : Key Players - SMART Technologies Inc ., Promethean World Plc ., Hitachi , Ltd ., Panasonic Corporation , Steelcase Inc & Others"
2019-03-27,https://www.marketwatch.com/press-release/lithium-ion-battery-market-is-projected-to-grow-us-92-billion-by-2024-2019-03-27,,2019-03-27 08:45:00,Lithium Ion Battery Market is Projected to Grow US$ 92 Billion by 2024
2019-03-28,https://www.businesswire.com/news/home/20190328005354/en/Global-60-Billion-Microgrid-Control-System-Market,,2019-03-28 09:00:00,Global $60+ Billion Microgrid Control System Market Outlook 2017 - 2019 & Forecast to 2026 ) - ResearchAndMarkets . com
2019-03-29,http://www.sbwire.com/press-releases/studio-camera-market-current-trends-and-future-aspect-analysis-2019-2025-1183259.htm,http://www.sbwire.com/press-releases/amp/studio-camera-market-current-trends-and-future-aspect-analysis-2019-2025-1183259.htm,2019-03-29 01:30:00,Studio Camera Market Current Trends and Future Aspect Analysis 2019 - 2025
2019-04-01,https://www.reuters.com/article/us-japan-display-funding/troubled-apple-supplier-japan-display-to-seek-funding-shares-surge-idUSKCN1RD13N,https://mobile.reuters.com/article/amp/idUSKCN1RD13N,2019-04-01 03:15:00,"Troubled Apple supplier Japan Display to seek funding , shares surge"
2019-04-02,https://japantoday.com/category/tech/Troubled-Apple-supplier-Japan-Display-to-seek-funding,,2019-04-02 02:00:00,Troubled Apple supplier Japan Display to seek funding
2019-04-03,https://www.prnewswire.com:443/news-releases/global-lithium-ion-battery-market-was-valued-at--24-5-billion-and-is-projected-to-grow-at-a-promising-cagr-of-15-to-reach--56-by-2024--300823162.html,,2019-04-03 00:00:00,Global lithium - ion battery market was valued at $ 24 . 5 billion and is projected to grow at a promising CAGR of 15 % to reach $ 56 by 2024
2019-04-04,http://www.jcnnewswire.com/pressrelease/50959/3/MHPS-Signs-TLA-with-CSIC-Longjiang-GH-Gas-Turbine-(GHGT)-on-H-25-Series-Gas-Turbine-Technology,,2019-04-04 03:15:00,MHPS Signs TLA with CSIC Longjiang GH Gas Turbine ( GHGT ) on H - 25 Series Gas Turbine Technology
2019-04-05,https://af.reuters.com/article/energyOilNews/idAFL1N21M21C,https://mobile.reuters.com/article/amp/af/idAFL1N21M21C,2019-04-05 01:15:00,UPDATE 1 - U . S . test nuclear reactor may run 40 pct over cost - govt document - Energy & Oil
2019-04-08,https://nuclear-news.net/2019/04/08/japan-business-federation-keidanren-wants-maximum-service-life-of-nuclear-power-plants-extended-to-over-60-years/,https://nuclear-news.net/2019/04/08/japan-business-federation-keidanren-wants-maximum-service-life-of-nuclear-power-plants-extended-to-over-60-years/amp/,2019-04-08 06:00:00,"Japan Business Federation , Keidanren , wants maximum service life of nuclear power plants extended to over 60 years"
2019-04-09,https://www.asiaone.com/business/hitachi-automotive-systems-showcase-wide-range-automotive-technologies-auto-shanghai-2019,https://www.asiaone.com/business/hitachi-automotive-systems-showcase-wide-range-automotive-technologies-auto-shanghai-2019?amp,2019-04-09 02:15:00,Hitachi Automotive Systems to Showcase Wide Range of Automotive Technologies at Auto Shanghai 2019
2019-04-10,https://www.businesswire.com/news/home/20190409006060/en/MHPS-Global-Market-Share-Leader-2018-Flue,,2019-04-10 03:00:00,MHPS Is Global Market Share Leader in 2018 for Flue Gas Desulfurization Systems
2019-04-11,https://www.marketwatch.com/press-release/image-sensor-and-color-sensor-market-2019-global-analysis-opportunities-and-forecast-to-2024-2019-04-11,,2019-04-11 09:30:00,"Image Sensor and Color Sensor Market 2019 Global Analysis , Opportunities And Forecast To 2024"
2019-04-12,https://finance.yahoo.com/news/japanese-supplier-apple-gets-1-1-billion-bailout-082804059--sector.html,https://finance.yahoo.com/amphtml/news/japanese-supplier-apple-gets-1-1-billion-bailout-082804059--sector.html,2019-04-12 09:45:00,Japan Display to come under Chinese group control after $2 . 1 billion bailout
2019-04-15,https://menafn.com/1098389743/Lithium-Ion-Battery-Market-To-Reach-US-47-Billion-By-2023IMARC-Group,,2019-04-15 06:00:00,Lithium Ion Battery Market To Reach US$ 47 Billion By 2023 | IMARC Group
2019-04-16,http://www.jcnnewswire.com/pressrelease/51170/3/AMADA-to-Construct-Main-Production-Facilities-in-Japan-through-Collaborative-Creation-with-Hitachi,,2019-04-16 01:15:00,AMADA to Construct Main Production Facilities in Japan through Collaborative Creation with Hitachi
2019-04-17,http://www.swissinfo.ch/eng/abb-ceo-steps-down-just-four-months-after-launching-overhaul/44903254,,2019-04-17 06:15:00,ABB CEO Steps Down Just Four Months After Launching Overhaul
2019-04-18,https://menafn.com/1098405673/India-Exhaust-Heat-Recovery-System-Market-Segmentation-Customer-Survey-2019-With-Continental-AG-Aptiv-Hitachi-Ltd-Robert-Bosch-GmbH-MAHLE-GmbH-DENSO-CORPORATION-BOSAL-Faurecia-Cummins-Tenneco,,2019-04-18 01:30:00,"India - Exhaust Heat Recovery System Market Segmentation , Customer Survey 2019 With Continental AG , Aptiv , Hitachi Ltd ., Robert Bosch GmbH , MAHLE GmbH , DENSO CORPORATION , BOSAL , Faurecia , Cummins , Tenneco"
2019-04-19,http://www.sbwire.com/press-releases/big-data-market-to-2024-global-analysis-and-forecasts-by-top-players-1198875.htm,http://www.sbwire.com/press-releases/amp/big-data-market-to-2024-global-analysis-and-forecasts-by-top-players-1198875.htm,2019-04-19 06:30:00,Big Data Market to 2024 - Global Analysis and Forecasts by Top Players
2019-04-22,https://finance.yahoo.com/news/nikkei-edges-choppy-trade-mufg-023643238.html,https://finance.yahoo.com/amphtml/news/nikkei-edges-choppy-trade-mufg-023643238.html,2019-04-22 03:00:00,Nikkei edges up in choppy trade ; MUFG falls on writedown worries
2019-04-23,https://www.dcvelocity.com/products/Business_Management/20190423-electric-motor-market-size-to-reach-a-value-of-1755-billion-by-2024--kbv-research/,,2019-04-23 06:00:00,Electric Motor Market Size to reach a value of $175 . 5 billion by 2024 - KBV Research – New Products and Services – DC Velocity
2019-04-24,https://www.wzzm13.com/article/news/holland-automation-company-sold-for-14-billion/69-96c7d4a7-89af-44ca-b8db-d255c3caca9d,https://www.wzzm13.com/amp/article?section=money on=business =holland-automation-company-sold-for-14-billion d=69-96c7d4a7-89af-44ca-b8db-d255c3caca9d,2019-04-24 03:15:00,Holland automation company sold for $1 . 4 billion
2019-04-25,http://www.jcnnewswire.com/pressrelease/51383/3/MHPS-Receives-Order-from-HAZAMA-ANDO-CORP-for-&quotMEGAMIE&quot-Hybrid-Power-Generation-System-,,2019-04-25 03:45:00,MHPS Receives Order from HAZAMA ANDO CORP . for  MEGAMIE  Hybrid Power Generation System
2019-04-26,https://www.japantimes.co.jp/news/2019/04/26/business/corporate-business/brokerage-house-nomura-posts-first-full-year-net-loss-decade/,,2019-04-26 07:15:00,Brokerage house Nomura posts first full - year net loss in a decade
2019-04-29,https://www.openpr.com/news/1721266/Permanent-Magnets-Market-in-the-advanced-material-industry-is-Likely-to-Reach-6-5-CAGR-in-2021.html,,2019-04-29 06:15:00,Permanent Magnets Market in the advanced material industry is Likely to Reach 6 . 5 % CAGR in 2021
2019-04-30,https://www.prnewswire.com/news-releases/storage-area-network-solutions-market---global-industry-analysis-size-share-growth-trends-and-forecast-2018---2026-300840199.html,,2019-04-30 00:00:00,"Storage Area Network Solutions Market - Global Industry Analysis , Size , Share , Growth , Trends , and Forecast 2018"
2019-05-01,https://prwire.com.au/pr/83321/hitachi-vantara-unveils-entry-level-storage-in-asia-pacific,,2019-05-01 04:15:00,Press Release : HITACHI VANTARA UNVEILS ENTRY - LEVEL STORAGE IN ASIA PACIFIC
2019-05-02,https://www.openpr.com/news/1724539/Global-Next-Generation-Data-Storage-Market-SWOT-Analysis-to-2027-Lead-By-Hitachi-Micron-Technology-NetApp-Nutanix-Pure-Storage-Scality-Tintri-by-DDN-Toshiba-Dell-and-Hewlett-Packard-Enterprise-Development-LP.html,,2019-05-02 05:30:00,"Global Next Generation Data Storage Market SWOT Analysis to 2027 Lead By Hitachi , Micron Technology . NetApp , Nutanix Pure Storage , Scality , Tintri by DDN , Toshiba , Dell and Hewlett Packard Enterprise Development LP"
2019-05-03,https://www.openpr.com/news/1726172/Air-Suspension-Market-by-Vehicle-Type-Technology-Component-and-Region-2025.html,,2019-05-03 07:15:00,"Air Suspension Market by Vehicle Type , Technology , Component and Region 2025"
2019-05-06,https://www.networksasia.net/article/sega-entertainment-selects-infor-erp-solution-modernise-its-operating-environment.1557113405,,2019-05-06 09:45:00,Sega Entertainment selects Infor ERP solution to modernise its operating environment | Networks Asia
2019-05-07,https://www.marketwatch.com/press-release/vvt-and-start-stop-system-market-by-camshaft-type-starter-type-and-fuel-type-global-opportunity-analysis-and-industry-forecast-2018---2025-2019-05-06,,2019-05-07 00:00:00,"VVT and Start - Stop System Market by Camshaft Type , Starter Type , and Fuel Type : Global Opportunity Analysis and Industry Forecast , 2018 - 2025"
2019-05-08,https://www.reuters.com/article/japan-stocks-midday/nikkei-tumbles-to-5-week-low-on-fears-of-deeper-u-s-china-trade-tensions-idUSL3N22K0P6,https://mobile.reuters.com/article/amp/idUSL3N22K0P6,2019-05-08 03:15:00,Nikkei tumbles to 5 - week low on fears of deeper U . S .- China trade tensions
2019-05-09,https://www.networksasia.net/article/hitachi-vantara-unveils-entry-level-storage-asia-pacific.1557372369,,2019-05-09 05:15:00,Hitachi Vantara unveils entry - level storage in Asia Pacific | Networks Asia
2019-05-10,https://www.businesswire.com/news/home/20190509006059/en/MHPS-Americas-Reports-Record-2018-Financial-Results,,2019-05-10 01:30:00,MHPS Americas Reports Record 2018 Financial Results
2019-05-13,https://news.yahoo.com/japan-display-says-bailout-chinese-group-could-delayed-073535687--sector.html,https://news.yahoo.com/amphtml/japan-display-says-bailout-chinese-group-could-delayed-073535687--sector.html,2019-05-13 10:45:00,Chinese group to delay bailout funding for Apple supplier Japan Display
